{
  "title": "The groundtrack file, locked",
  "eyebrow": "Ticket 32 · call-graph map · 2026-09-02",
  "problem": "groundtrack is a planned skill. An agent writes one JSON file, and a page draws that file as a call graph. This box decides the file's shape: what an agent writes by hand, what a program checks, and what a file may leave out. Two constraints are fixed and no row moves them: the skill folder installs no dependencies, and the page needs no server. While the shape stays open, no implementation session can start.",
  "who": "The agent that writes each file, the reader of the drawn page, and the owner who maintains the skill.",
  "when": "Before any implementation session starts, because the skill has no other specification.",
  "dims": [
    {
      "id": "premise",
      "name": "The lock itself",
      "question": "Does this ticket fix the file shape now?",
      "problem": "A fixed shape states every field, its meaning, and whether a file may omit it. Three prototype files exist today. Their shape grew one program at a time, so no document states it. This row asks whether the effort fixes the shape now, later, or never.",
      "opts": [
        {
          "id": "premise-lock",
          "label": "Fix the shape now, in this ticket",
          "short": "Lock it now",
          "chosen": true,
          "src": "#32"
        },
        {
          "id": "premise-defer",
          "label": "Fix the shape during the session that builds the skill",
          "short": "Lock it later",
          "strawman": true
        },
        {
          "id": "premise-none",
          "label": "Leave the shape open; each file carries what it needs",
          "short": "Never lock it",
          "strawman": true
        }
      ]
    },
    {
      "id": "walk",
      "name": "Who makes the walk",
      "question": "Who produces the step tape, and what makes it honest?",
      "problem": "A walk is a flat list of moves through the graph, and the page plays it. Today a script runs a small interpreter over the file and writes the walk back. Every walk in the three files says 'authored', and the same walk names the script that made it. This row decides who makes a walk and what checks it.",
      "opts": [
        {
          "id": "walk-recorder",
          "label": "The skill ships the recorder and computes every walk",
          "short": "Recorder ships",
          "src": "#43"
        },
        {
          "id": "walk-checked",
          "label": "The agent writes the walk; a checker proves it is a legal path",
          "short": "Authored, path-checked",
          "chosen": true,
          "src": "#32 grilling, round 1"
        },
        {
          "id": "walk-trust",
          "label": "The agent writes the walk; nothing checks it",
          "short": "Authored, unchecked",
          "strawman": true
        },
        {
          "id": "walk-none",
          "label": "The file carries no walk, and the page only draws",
          "short": "No walk",
          "strawman": true,
          "src": "#28, first answer"
        }
      ]
    },
    {
      "id": "expr",
      "name": "What an expression is",
      "question": "Does a shipped program run an expression, or only show it?",
      "problem": "Fields such as expr, cond and args hold strings. The prototype interpreter passes each string to new Function and runs it. An agent writes these strings by hand. This row decides whether any shipped program runs them, and therefore whether the shape must define a language.",
      "opts": [
        {
          "id": "expr-js",
          "label": "Any JavaScript expression, run by the recorder",
          "short": "Run as JavaScript",
          "src": "the prototype"
        },
        {
          "id": "expr-subset",
          "label": "A named subset of JavaScript, run by the recorder",
          "short": "Run, subset only",
          "src": "#32 grilling, round 1"
        },
        {
          "id": "expr-caption",
          "label": "Text the page shows; no shipped program runs it",
          "short": "Shown, never run",
          "chosen": true,
          "src": "#32 grilling, round 1"
        },
        {
          "id": "expr-struct",
          "label": "Structured objects in place of strings",
          "short": "Objects, not strings",
          "strawman": true
        }
      ]
    },
    {
      "id": "unknown",
      "name": "An unknown key",
      "question": "What happens when a file carries a key the shape does not name?",
      "problem": "An agent that writes a file by hand misspells keys. A checker can refuse the file, warn about it, or say nothing. The third answer changes what the drawing means and gives no signal.",
      "opts": [
        {
          "id": "unknown-refuse",
          "label": "The checker refuses the file",
          "short": "Refuse the file",
          "chosen": true,
          "src": "#40, shape 1"
        },
        {
          "id": "unknown-warn",
          "label": "The checker warns and continues",
          "short": "Warn, then continue",
          "src": "#40, the middle answer"
        },
        {
          "id": "unknown-ignore",
          "label": "The checker says nothing",
          "short": "Say nothing",
          "strawman": true
        }
      ]
    },
    {
      "id": "schemadoc",
      "name": "The shape document",
      "question": "Does a machine-readable shape file exist, and what holds it true?",
      "problem": "A shape file states the fields for an agent to read before it writes. Nothing forces that file to match the checker. On the sibling skill six differences already exist between the two. This row decides whether the document exists and what binds it.",
      "opts": [
        {
          "id": "schemadoc-bound",
          "label": "A shape file, bound by a case list run through the checker",
          "short": "Bound by a case list",
          "chosen": true,
          "src": "#40, shape 2"
        },
        {
          "id": "schemadoc-loose",
          "label": "A shape file that nothing binds",
          "short": "Unbound document",
          "strawman": true,
          "src": "#40"
        },
        {
          "id": "schemadoc-gen",
          "label": "A shape file generated from the checker",
          "short": "Generated from checker",
          "src": "#40, shape 3"
        },
        {
          "id": "schemadoc-none",
          "label": "No shape file; the checker's refusals are the record",
          "short": "No shape file",
          "strawman": true,
          "src": "#40, shape 4"
        }
      ]
    },
    {
      "id": "clash",
      "name": "One name, two meanings",
      "question": "What happens to a field name that means two things?",
      "problem": "The name label means a jump target on a program step and display text on a walk step. The name kind means a node category and an effect category. The prototype states the first rule in its own header and breaks it in its own code. This row sets the policy for every such name.",
      "opts": [
        {
          "id": "clash-all",
          "label": "Rename every field whose name means two things",
          "short": "Rename every clash",
          "chosen": true,
          "src": "#32, the label trap"
        },
        {
          "id": "clash-bitten",
          "label": "Rename only the names that already caused a fault",
          "short": "Rename what bit",
          "src": "#32 grilling, round 1"
        },
        {
          "id": "clash-keep",
          "label": "Keep the names and document both readings",
          "short": "Keep and document",
          "strawman": true
        }
      ]
    },
    {
      "id": "vocab",
      "name": "The node category",
      "question": "Which words may name what a node is?",
      "problem": "Each node carries a category. Three files used five words: agent, pure, io, handler and prototype. Two of those describe code. Two describe tracker work. This row decides whether the shape fixes the list, opens it, or drops the field.",
      "opts": [
        {
          "id": "vocab-enum",
          "label": "A fixed list the checker enforces",
          "short": "A fixed list",
          "src": "#32 grilling, round 1"
        },
        {
          "id": "vocab-open",
          "label": "Any word; the page prints it",
          "short": "Any word",
          "chosen": true,
          "src": "#32 grilling, round 1"
        },
        {
          "id": "vocab-starter",
          "label": "Any word, with a starter list in the document",
          "short": "Any word, list given",
          "src": "#32 grilling, round 1"
        },
        {
          "id": "vocab-drop",
          "label": "No category field on a node",
          "short": "No category field",
          "strawman": true
        }
      ]
    },
    {
      "id": "tests",
      "name": "What the test field names",
      "question": "Does the test field name the files that enter a node, or the files that cover it?",
      "problem": "A node may carry test files from the change. One reading names the specs that call the node. The other names the specs that cover the node's concern. On one measured node the two readings disagree: no spec calls it, and its work is covered through its caller.",
      "opts": [
        {
          "id": "tests-enters",
          "label": "Files whose specs enter this node",
          "short": "Files that enter it",
          "chosen": true,
          "src": "#42"
        },
        {
          "id": "tests-covers",
          "label": "Files whose specs cover this node's concern",
          "short": "Files that cover it",
          "src": "#42, the second reading"
        },
        {
          "id": "tests-both",
          "label": "Two fields, one for each reading",
          "short": "Two fields",
          "src": "#32 grilling, round 1"
        },
        {
          "id": "tests-drop",
          "label": "No test field on a node",